comment,star
"The case was very nice for a week or two and then stretched so bad that my phones corners were constantly popping out of it. I had to pop the phone back into the case every time i took the phone out of my pocket. Also the more rubbery part of the case (the sides that stretched) yellowed a lot after just a couple of weeks of use. Could not return it to Amazon bc i didnt have the original box so I submitted a warranty claim on the Otterbox website. They asked for photos and said that my case might qualify for a replacement and i need to ship it back to them. They said that they couldn’t provide a shipping label but my shipping fee will be waived on their side. Liars. So i go and spend $30 on shipping it back, send them the receipt and they say they are not going to reimburse it now. Would not even give me a gift card for that amount. So i end up spending $80 on a bad quality product that i dont even have anymore. I ask them if they can at least send me a replacement in a different color so there is no yellowing problem to which they agree (they said they would make an “exception” for me). But then they ignore me for days. FedEx said that they received my package on Dec 9 but on Dec 19 Otterbox said that they dont have anything and they cannot track my package bc the tracking website didn’t work which of course it did. That was the last email I received from a human. On Dec 22 I received an automatically generated email that my package has been received (13 days after it actually arrived) and that was it. They have been ignoring my emails and not responding. $80 and a lot of my free time down the drain. I would not recommend doing business with them to anyone. I trusted their reputation and I should not have. This is the worst customer service experience i have ever had.",1
"This item looks good, the 2-in-1 separate filter line is useful, and installation was straightforward.Unfortunately after 18 months, the faucet started leaking from inside the metal housing. Even when the faucet was turned off, water would leak slowly from inside the housing, down the line, and dripped over a few days. It ended up ruining my cabinet and the drywall on the ceiling of the floor below.The manufacturer, Kraus, claims a ""lifetime limited warranty"", but within the warranty text, the faucet hardware is only covered from defects for 1 year and 5 years, with more limits. After 1 year, they will also charge you for shipping the defective item back to them.I understand that I should have read the warranty terms in more detail before purchasing the item. However, I didn't expect a kitchen faucet to fail within such a short time frame, given how expensive it was. I also take issue with companies that try extract shipping fees from their customers when their products are defective and under warranty.Since I wasn't interested in paying for shipping to have a defective item repaired, and no longer trusted the manufacturer, I asked about return options. The agent condescendingly answered, ""honey, we're the manufacturer, you'll have to call Amazon about that"" and abruptly ended the conversation.I understand that defective items will occur from time to time. However, I do expect that companies stand by their products and provide support for their customers when it happens. Unfortunately Kraus is not one of those companies and I had to go through Amazon to get help with this situation.I'm sure most people who have bought this product have a faucet that's working fine. However, in the off chance that you get a defective unit, just know that Kraus will not be helpful. You're better off buying from another company for the same price range.",1
The handles fell off the replacements,1
It’s not like the pictures. No metal thing to hang it on. Looks homemade.,1
"These candles were lovely until one totally died even after battery replacement. It won't work at all. These are way too expensive to only last 4 months. I turn them on about 3 times/week for an hour, not every day. Disappointing!",1
"Dollar stores have a better quality then this product, and 10 times cheaper.",1
Keyboard is cheap looks like a disco . Slow,1
POST beeps indicating corrupt bios. Returning.,1
"First boot, saw the windows logo, then BSOD. Couldn't get it to recover as it didn't have a recovery image installed. Couldn't boot safe mode, error stating couldn't install windows in safe mode. BSOD after BSOD after BSOD. Additionally, Amazon customer service was lacking in this experience.Returned for refund. Gotta love the new 30 days to refund on higher priced items like this. Maybe I can order one next month.",1
"ive had this pc for a good 3 and a half years already bout it to play games, but after realizing the hardware was 10+ years old i couldnt play nothing on it so i just used it for school work and ext. Out of the 3 and half years ive had it most of the time ive had it it was either not working at asurion getting fixed or on and not even being used cause itll crash every opportunity it gets. I really wished i refunded when i had the chance but i was to ignorant, after these 3 years ive seen plenty of videos on these pc scams and ext and you can get this exact same computer for a quarter of its price. dont get scammed just because it looks good and has LED lights this computer is literally useless. For 500$ you can find a computer wayy more advanced than this one and last way longer. im truly upset on this purchase its the worst of my life (i just got done paying it off)",1
"Several times it shut down with hardware erro4s and is not compatible with Windows 11. And I constantly have to unplug the keyboard and the mouse and plug them back in to get them to work. I have to do the same with my camera. The box looks great but what a crappy computer it is slower than DialUp they give you a little USB to plug into the computer to have Wi-Fi. It’s the same size as the USB square that comes out of your wireless mouse. What an awful experience from the very first week I bought this computer to the last right now. It is completely shut down I’m in the middle of a business everything I have is on this computer on the cloud to return which I don’t have access now , it’s just horrible . Look at the second picture behind my computer, you’ll notice that the only things that are plugged in are the monitors, keyboard and mouse. And if you look at the first picture, you’ll notice the errors card via storage device, such as an external USB drive, which we don’t have faulty hardware such as a hard drive or CD ROM, which apparently we do now just awful.",1
This computer was marketed as a new gaming computer and never worked at a level for gaming. After a year of trying to make it work we brought it to a professional and they said the components were 5-6 years old and we were better of buying a different computer vs trying to update/fix this one. Thanks for making a kids dream Christmas gift a complete lemon.,1
"This computer is garbage! Parts are from 2011. You'll spend more than what u bought it for to upgrade it to work for ur games! Do urself a favour, save ur money & DO NOT BUY THIS COMPUTER!",1
"I want a full refund of my money you can’t even use the internet without it lagging, can’t even load fortnite let alone play it got into one match with 4 fps with everything to the lowest I will not stop emailing until you have refunded me",1
"This PC was great to look at, and that's about it. The Wifi was terrible/damaged idk. We even used a third party wifi adapter and it was still awful. We have a 330mbs internet and all my other devices ran fast, so that wasn't the problem. Afterwards, it didn't detect my monitor. I ran it for a couple of minutes and nothing. It sounds like a jet engine while it's running as well. Over all, this PC is not worth the headache I went through. Save your money and look for another option.",1
"The monitor support bar didn't fit .. then once we rigged something together and set it up it kept restarting, wouldn't get past initial set up. DO BETTER !!!",1
The media could not be loaded. The pc and the monitor would not connect at all. The monitor would flash on and say no signal then turn off. The desktop itself from the moment of turning it on made that very loud motor boat sound. The advertised keyboard and mouse were not included a standard set was.I called support who advised they would try and connect me with a IT Person and that took over 30 mins. IT kept telling me to unplug it and plug it back in. Return support was not helpful either please don’t waste time or money on this!,1
Fine for the first few times that it was being used but now is laggy or completely shuts down. Only purchased in August of 2023 and it's now January 2024 so only had it for less than 5 months and it isn't even used heavily. Disappointing.,1
"product is very very bad packaged , LED not working with a very very very small electricity output cable . i literally had to get a power source 5CM beside it to make it fit and still LED not working",1
"This console was a brick the day it was released. As usual, Microsoft is years behind its competitors. I don’t even know why I was stupid enough to purchase one. The biggest issue is that in order to play games you purchased, you must constantly update them. That’s ridiculous. Why? It was working just fine. The other issue is that it continues to take up more and more space. I regret few things in life, but purchasing this junk has to be on the top. Save yourself some headache and buy a different system.",1
"I bought this ”refurbished” console in July, and it stopped turning on in November. This was sold as an “Amazon Refurbished” console. The customer support at Amazon told me they wouldn’t replace it, and they wouldn’t take a return on it. The “warranty is for 90 days,” and the console turned into a brick at 120 days, so there’s nothing that Amazon will do to stand behind their product. They told me to contact Microsoft for help. The warranty that Microsoft gives is from the original purchase date of the console. In my case the “Microsoft warranty” ended on Nov. 21st, and the console quit working on Nov. 25th. So lucky me the only thing I can do is pay Microsoft an additional $300 to get this console replaced. So because I’m one month outside of 90 days and 4 days past a warranty that started before I even owned the console I now own a $450 paper weight. And if I want the company to fix or replace it I get to own what will be a $750 console. All because I trusted Amazon to sell a working “refurbished” console.",1
I thought I’d give this a go seeing as it was Microsoft refurbished. Looked brand new when opened. Everything was great. Then while installing games and watching a movie it locked up. I rebooted and it would lock up then shut off. I reset it several times. Same issue. Safe to say the SSD failed. Spend the few extra dollars and buy new. Waste of time and money.,1
"Picked the referbished unit for the savings. Worth the price. Came with the full warranty. Controller looks new. Was the price of a used one on the local buy and sells, and has warranty. A no lose situation.Update, controller drift after 40 days. Amazon will not accept return and Microsoft will not warranty. DO NOT PURCHASE****",1
"I bought this as a gift and unfortunately was left extremely disappointed. The controller didn’t work, the console freezes during game play with almost every single game we tried and then one week later it will not turn on. Well, it turns on, but nothing will display on the TV other than the Xbox logo. Extremely disappointing and embarrassing given it was a gift. Seems that buying a new one may be worth the money if this is the best alternative. Returning asap and will be using the money toward a new console from a legitimate seller.",1
Product failed on second day. Returned!,1
"Package arrived early, which was nice, console turned on and worked fine, until it came to reading the discs. The console did not work any further than the home screen, super disappointing. And upon trying to clean the disc scanner, the console was customized so there is no access to this point of the hardware; a part allowing you to go further is missing and replaced with a custom piece that won’t move, meaning if it is broken, its broken. There’s no hope in repairing it yourself. Was looking forward to it but was let down",1
I understand this item was not going to be brand new. That said the quality is very poor. Rusted insides not refurbished at all. Does not power on. Oveall disappointed that they would even take someones money and be ok with sending this out.,1
"This phone was not usable on Straight Talk Wireless. Straight Talk informed me that the phone was locked and could not be used on their service until it was unlocked. This phone is listed as unlocked and usable on any service. I contacted Samsung because these are new phones, they had me do a factory reset on the phone and said that would fix the issue. This did nothing to fix the problem.",1
"UPDATE: After having this phone for months I have to say it's the biggest POS that I've ever had!! More glitches than I could list. I took 4 stars away because I'm so angry at all the glitches. Now I'm going to go back to my A10E, at least that was reliable!!I decided to wait to write a review because I was on the fence about keeping it or not. My previous phone was a Samsung A10E which is not a very heavy phone. The A15 is considerably heavier which I am (still) not very comfortable with. Comparing the 2 phones as far as memory is concerned is markedly different. The A10E has 32 gigs of internal memory. The A15 has 128 gigs of internal memory. Considering that I have alot of pics on my phone with several different albums, this makes the A15 a better product. The battery life is quite good. The appearance is beautiful. I purchased the light blue phone. I have a clear cover on my phone. This is my 4th Samsung cell phone. Samsung never disappoints with quality, durability and performance. I love the Samsung Smart Switch which makes moving your data from one phone to another fast and super easy. They don't provide a SIM card or micro SD card so you need to make sure to move your cards into your new phone. The software is similar to previous Samsung phone with a few tweaks. For example, to get a screen shot for the A15 you need to press both power and volume down button simultaneously. What makes the A15 different from any of my previous Samsungs is with the A15 you have to press each twice. There is a feature that would put a floating icon on your screen and open it and tap screenshot then you will get your screenshot. Now, what sold me on the A15 is a neat feature where, upon your approval, they will block all spam/scam phone calls. So no more annoying spam/scam calls!! It's a neat feature!! Like I said, I love Samsung phones!!",1
"How many apps do you think you have on your phone? 40? 50? how about your phone from 2 or 3 years ago? 15-20 tops? LOL ah, yes the days when we got excited to get a few free apps or games on our new phones... alas those days are OVER bro! get you a variation of the moto g device family. Out of the box, she is pretty amazing. I didn't have a single complaint really. Super fast, tons of storage, great camera, new updated apps, lots of customizing, etc. JUST WONDERFUL. After a few months it happened, the dreaded update in April I think it was, maybe March, I now have 400+ apps. (I will attach a pic, it shows 399, there have been about 30-40 more that have trickled in since the initial dump, which took about 5-7 days to finish up... and 75-80% are ""system apps"" (bloatware from any and every carrier in fact.... ALL. OF. THEM.) For example, a bluetooth app for t-mobile, & verizon, & sprint, & metro, && cricket. Before you say, ""just uninstall them and move on!"" - I did. I have. I've factory reset twice and they're just BUILT INTO THE phones disk memory. There simply is no ""delete"" them. Some of them, as duplicatory as they are, messing around with them can still brick up your jawn within a few clicks... and before you even start, you are not a dev... so chill, I mean neither am I... but you just stay out of that menu, that app, and that folder. Really, who knows why they name everything in tech sketchy stuff like ""com.sys.IM-WATCHING-YOU-PAM.000"" and ""<%real/secret/23-LISTENER999>... but anyways... JUST PROMISE ME, YOU WON'T GET INTO THAT APP, OR FOLDER.... okay?So Motorola should reimburse me for having to put myself through IT school to teach myself to operate on this phones guts and remove all these garbage apps manually to create the phone I thought I purchased. All you can do is force stop and disable them. Buuut I still feel like they are gathering data, bc, why wound't they be. Its not just this model either, my partner has the moto g stylus 5g and its even worse on theirs. the play store basically never gets a break from constant updates (and then theres the transferring of precious data to the mother ship)yeaaaa we also had to upgrade our home internet plan and router because of all this. We couldn't both use the wifi at the same time doing anything at all. it was crazy. allllllso the apps are gathering intense amounts of data and ALL WANT crazy permissions that have nothing to do with the app itself. like the calculator wants camera permissions... nuts. The sheer number of apps that require making system changes or having total device control... it was too much. I would almost ask for a refund, but from what I see these days most phones are leaning that direction, making money off our god given ones and zeros.... and then still try and look at us in the eyes while they sputter out the retail price of the next generation of your favorite device. can't even hold it down on a free case or something..THEN - - when you finally get a break from force quitting and removing permissions that, somehow keep TURNING BACK on... you might have a few minutes to enjoy a quick photoshoot. NOPE. the camera app it comes with stinks, it just soooo basic.. so then you think, oh, i'll download a cool camera app off play store... NOPE. theres a fricking governor on the camera. That makes it so NO 3rd party camera app will get full usage of ALL THE MEGA PIXELS YOU PAID YOUR HARD EARNED MONEY FOR (48 megs to be precise, which is overkill, but still, you will be lucky to get to use 10 or 12 MP!!)Seriously. And JUST as google starts conveniently implementing the awesome 2 step verification, and authentication keys.... JUST in time for you to have to answer to your wife about why you don't have as much info in your google takeout as she does... yikes... oh and squeeze on some more of that exact same conversation about your FB activity as well.. yaaaaay.So, let me get this straight... I now have to REMEMBER ALL MY UNIQUE PASSWORDS && double log in, && verify 3 ways, all to check a notification thats just a promotional email about the new apps GEWG will put out next week. AND then FINALLY the google security come forward to say they don't trust my log in (bc i've got a VPN) - - - (from guess who - G1 - duh!) and they really cant tell the difference between MY REAL actual login on my trusted device from what it must assume is a HAKKr logging in 3 states away. . . . . . E.V.E.R.Y. LOG - INNNN!at this point i am thinking about a jitterbug and some stress eating of sour worms to relax.but yeah the phones cool, other than that.",1
"This was my 2x trying Amazon Renewed. This time I purchased the LAST stated available 2023 described as ""In OEM box, Box shows wear from opening"". The Moto Razor Flip phone was described as ""Like new"". Immediately upon arrival w/o even opening the box I knew it was wrong as the package was far too light. I opened it & there was a Moto Razor w/obvious discoloration on the case from use + a CHIP in the bottom screen. Packaging was similar to a top end Samsung I ordered from Amazon Renewed & fulfilled by a 3rd Party in FL 2 years ago. I saved due to credit only $20 @ checkout over a NEW One. WORSE there's NO WAY to return this immediately (There' are 2 Amazon Return 2 locations within 2-5 minutes of my house. Just came back from one & CS stated ""I've never seen this"")). Instead Amazon MAY notify me when they'll ONLY pickup from my house in 3 days.I had this EXACT same problem with a $700+ Laptop that was supposed to be Brand New. I'm beyond a coder or tech guy & ran a battery cycle count software on that as the battery lasted 2 hours less than advertised. It was obviously a RETURN, re-sold as NEW, unless Compaq sells Laptops w/over 200 battery cycles already on them. Same thing w/2 PB's & a CH Android Tablet which still had the previous User's name & account information installed. Seriously, WHO is doing QC? I'll NEVER use Renewed again. Period. Even when you buy a NEW item it's 50/50 now you'll get someone else's return sold as New! eBay here I come again. Worst thing this was supposed to be a gift. OBVIOUS Screen CHIP really ticks me off. Since 2022 I'm now 2 for 8+ on purchases of tech devices. Buy with caution!",1
The system worked well for a few days .Then multiple issues launching any game arose.All games were bought new .Very aggravating.Not sure what to do now .I guess I just threw away money for a game console that barely works .Hope other people have better luck .Take care .,1
"Ever since I got this thing it’s been a source of frustration. It picks and chooses what games it allows me to play. Whenever I put a disk in it won’t read it, it’ll say open tray as of there isn’t even a dick inside. I have to open and close the tray 5+ times to get it to work. Sometimes it doesn’t. Some games it won’t play at all. I have a feeling that whoever inspected this thing before resale just looked it over and said “looks fine to me” and pushed it down the line. Piece of junk",1
"Not sure if I received a defective batch, but this set was horrible. All the “slimes” were sticky like glue and watery. Not useable. Waste of money.",1
"Well where do I begin? The tray door wasn't opening, handled that. It's not playing any of the games at all. This game system specifically said in good condition not seeing that at all. It's not even reading any of the games at all. So basically I just wasted $367 so I definitely feel like I have been scammed. This is so ridiculous. Ordered through Amazon I thought was a reliable place. Never had any problems before through them. So I figured why not? Well this is the absolute last time I'll be ordering anything that's refurbished or used. This is pure junk Xbox 360. Wasted my money and time. So thank you for that.....I hope this helps the next buyer plz beware of the scams.",1
"The eiffel tower does not sit flat on the base and is not study as it is so will definitely fall off with any unexpected movement...very disappointed in this product, not suitable as a gift.",1
"Has paper on back you cannot get off, takes away the entire effect",1
Got the pig one for my little brother and was so excited for it to arrive . Once we received it we were very disappointed with the quality of it . The pig is not stretchy at all doesn’t even go back into shape . You can feel balls of clumped up sand . I found a bigger size gorilla for cheaper at hobby lobby . Don’t waste your money,1
First purchase the foot completely severed. Returned and got another and the hand fell off. She barely plays with it to begin with so it wasn’t damaged to break like that. Waste of money. Would return but already passed return date smh,1
"The media could not be loaded. Ok, I’m so confused. I didn’t open this for a couple weeks after getting it while I was finishing my last bottle. The seal on the bottle was intact. Unfortunately now I’m outside of my window to return.This was the worst experience ever. At first it was bright purple, for a few days. But even while purple… it felt clumpy and silicone-like. Previous purple toothpastes (including a previous Meto purchase) felt like regular toothpaste that lathered as you brushed… this one doesn’t. It just breaks into smaller chunks and won’t stick to your teeth.I included a video of how it has turned brown and continues to stay that way no matter how much I pump out of it… looks like it’s oxidized? Or just flat out spoiled?! For the record I’ve kept the lid on it 100% of the time that I haven’t used it. Idk but something is WRONG with this one and I will NEVER purchase from this brand again.I’m just praying I don’t get sick from this somehow. Would give negative stars if it were possible- especially since once your window to return the product is over, so is the ability to contact the seller!",1
