comment,star
"I was super excited to try this carbon toothpaste that also whitens! The packaging is great and the color of the paste is pleasing to the eye. Here's the thing though, I don't think I'm the target demographic because it did nothing for my teeth. I'm trying not to blame the product because my teeth are pretty stained from when I smoked for years and also coffee. So I didn't notice any significant or even insignificant change to the color of my teeth when I used this but when I switched back to my usual whitening toothpaste, I of course noticed it immediately. Perhaps someone without the wear and tear of my dental history will have better luck. This could work on someone with only light staining on their teeth but unfortunately not for me.",2
"Tastes of grape, that's all, doesn't whiten teeth",2
It did not attach to the toothpaste tube tight enough.,2
"The product comes out as a foaming mess that has a disgusting feeling in the mouth. I tried it anyway, to give it a chance. Absolutely no difference in teeth color than before. Don't waste your money.",2
The seal was broken and the product was very moist from humidity and I will not be using.,2
If I had seen that these tablets were foaming toothpaste tablets I would not have purchased them. I ended up having to go to the store to purchase some without that ingredient.,2
"I expected that each eye would adjust as needed; however, the one eye that I needed improvement appeared to adjust but my other eye, without any sight problem, also adjusted so now I have the same problem but the other eye. Cheaper to keep as back up then return.",2
The autofocus works fine. I just had cataract surgery 4 weeks ago and the second eye last week so I couldn't focus to even use my cell phone. The glasses are cheaply made but will hopefully last for 5 more weeks until my prescription ones arrive.,2
"GOOD QUALITY LENSES BUT THE FRAME IS BROKE IN A MONTH, LIKE I'VE BOUGHT CHEAP QUALITY. VERY DISAPOINTED , SOMETHING WENT WRONG WITH MATERIAL THEY STARTED USE , HAD MY OTHER PAIR FOR YEARS AND IT TOOK A BEATING, THIS TIME VERYWEAK CONSTRUCTION",2
The lens came off several times and I ultimately lost one of the pait. The lenses were meticulously cleaned before installation. They worked well until the lens fell out Disappointed!,2
Too Heavy,2
"While I measured carefully, the clips were too narrow for my glasses so I returned them. Lesson learned--seller refunded less than half of the purchase price.",2
"I need very light reading correction (0.5), which these claim to help since they range 'automatically' from 0.5-2.5 in strength. At a normal reading distance for me, everything is very blurry with these on, there is no 'auto' adjusting. The product name also mentions ""multi flex focus dial"". I don't know what 'multi flex' is supposed to mean, but I can tell you there is NO focus dial. As far as I can tell they are plain 2.5 strength readers, which, for me, is way too strong. Color me disappointed and shame on the seller for keyword stuffing their product name with incorrect info.",2
AFTER OPENING THE PACKAGE AND CHARGING THE GLASSES I PUT THEM ON AND THEY SCRATCH MY NOSE. I CHECKED THEM AND THERE WAS NO NOSE PIECE TO PROTECT MY NOSE. I HAD TO RETURN THEM AND ORDER ANOTHER BRAND.,2
Quality is fine for the price but I look like Mrs Claus. lol. I'm not even that old.,2
"I might have ordered the wrong magnification, but I also didn't like the iridescent coating on the outside of the lenses.",2
The lens automatically fog up when you put the glasses on and I think they are low quality lens. Love the look and the replacement batteries but I will not reorder these.,2
"I decided to try bifocals for my first readers, hoping they’d save me from constantly taking them on and off. Unfortunately, they didn’t quite work out. The reading focal area is way too low, which makes it uncomfortable and awkward to use. The focus area is oddly positioned and doesn’t blend well with the rest of the frame, making it look unattractive. While they’ll do in an emergency, the quality just isn’t there. I ended up switching to a different brand with progressive lenses for a much better experience.",2
I've been wearing Foster Grant reading glasses for years and always purchase the same model. The glasses that I ordered were to be Ironman IronFlex black/red framed glasses. Instead of shipping the ordered glasses I was sent unframed glasses blue/grey#dg1123 IM1001 GUN. I was to receive IM2002 model but didn't. Caution buying these glasses.,2
I purchased these to replace my previous pair of the same glasses. These seem to be much larger and kept falling off my head/face. Will be returning these.,2
This is the third pair of these exactly same glasses that I’ve purchased. This pair was loose at the temples on arrival and tightening didn’t resolve the issue. Kept because they arrived at Christmas just before traveling out of town,2
Don’t waste your money on these glasses! Worn for reading only and the lens falls out! The arms are extremely tight. Very flimsy.,2
I dislike the feeling of wearing them and seeing outside the frames and inside. It was very odd and disconcerting. I returned them. They made you dizzy looking up.,2
Cannot wear for a long time as edges are hard. Have to line up perfectly as not to have double vision.,2
I braved the bright morning commute sunshine to test these. (I'm just a passenger) No shading at all. Yes I gave them time sat them on my dash too. No luck. Painful. Wearing my polarized sunglasses I could see some slight rainbow staring on the edges but not enough to tint the lenses. Also the bifocal line is really pronounced right in the middle of my eyeline - and maybe that's just the size of my face I have a smaller head. If you zoom in on my pic you can see what I'm talking about. I could still use inside or at home but only while specifically reading. I don't think I could walk around with the bifocal line.,2
Attempted to catch them from falling from my face and they snapped in 2..,2
Doesn’t cool at room the size it says it does:-(,2
"I usually don’t write reviews, especially negative ones. I liked this product when I initially got it. But after using it for only two summers the pump stopped working even with regular cleaning and maintenance. Because the water is no longer pumped into the filter, it does not actually cool anything. It looks like the pump can’t be easily replaced. So I liked it in the beginning but it didn’t last. Now I just use it as a bulky floor fan.",2
Don't recommend it,2
This unit just blows hot air around and doesn’t measure the temp in the room only the temp of air it’s putting out.,2
"The ice packs would melt and warm up fast, and you only felt the cool air when you are about 2 feet or closer. The fan does not blow hard/fast enough.",2
This product cools my from 95 degrees to about 90 degrees if I’m lucky. Save your money and buy an a/c unit.,2
It stays cool for a few hours and then doesn’t. It’s also difficult to clean as you can’t remove the tank.,2
Don’t cool down,2
Does not blow cold air long even with the ice pack in the bottom,2
I ordered this to cool a bed room for my kids. It’s hot and humid.. the AC UNIT needs work and thought this would help but wasn’t worth it and ima have to return.. I don’t feel the difference from fan to AC it’s all the same the humidifier looks like it works as the vents cleaned my air in 1day the filter was getting fDirty,2
The only time you cool off is if you’re right in front of it.I don’t not recommend and SUCH a waist of money!,2
Annoying flashing lights when off. Ice packs swell too much even half full. Good for a small room but not a powerful fan. Can't complain for the price though.EDIT 9/23/2022: Piece of junk now. Swing function quit working. Pump intermittent and indicator light quit working. Cheap for a reason. Would not buy again.,2
"Received this couple months ago doesn't do much ,,fan works better .not advisable for the money very disappointed",2
I bought this for a friend and watched it with him. I knew it would be bad and it was. I guess if you like this kind of thing then it would be good for you. I on the other hand have taste.,2
"Bad special effects, a completely wooden plot nailed to cardboard characters, bad acting and cheesy gore effects do not compliment would could have been a very scary movie. Inexplicably incestious Cat people live like cia undercover agents in a small town, and stake out victims to gain energy. There is no explanation as to what these creatures are, and basically the whole thing is a solid vehicle for a bunch of scenes involving painfully conspicious latex prop limbs being torn and split while the creatures feed off of the energy of fresh victims (one scene where a man has his hand cut off actually rivals luke skywalker's incredibly unconvincing appendage loss in ""The Empire Strikes Back). The cat people themselves are reminiscent of japanese rubber suit monsters (one almost expects power rangers to jump out) and the morphing special effects look ridiculous. Entertaining enough to warrant watching the whole thing ... even If not for any reason it intended to be.",2
"Well the it starts out pretty good. the plot is alright, the actors are pretty good and the special effects are amazing for when it was done. Then in the end it all gets wacky... almost like a comedy. One scene when the seriously dissturbed mom (Alice Krige) kills a guy whit a corncob! But when it really gets bad is in the end when you see how the ""sleepwalkers really look...",2
"It's terrible! About the only thing it had going for it were the special effects and the musical score. Don't get me wrong, I love Stephen King, and I love scary movies, but this one is just plain sick.",2
"This CD just about drove me nuts. I understand that rain is to be expected in a rainforest,but after listening to this recording my pets were lining up two-by-two. This CD is for you if you love a long rain and dripping sounds. I hated it; it was monotonous and I could swear that there were portions that were repeated because the person recording it had to fill up some space and nothing was available.Save your money!",2
"This book is not an easy read; to many diversions within the story to get excited about the character. It hurt my ""head"" to try and stay with it. I enjoy reading, but this book takes the joy out of reading! It has taken me months to get to the 6th chapter",2
"Very average movie, Jonny Debbie as wonderful as ever. If you want to see it then rent it, not a keeper",2
"Yes, Johnny Depp provides another great performance here, as does most of the cast. The story line is what drags this movie down. Beyond the slew of predictable lines and scenarios, I found the message of the film a bit shallow. ""Love conquers all...including schizophrenia."" It's just not life-like. Some of the imagery and allusions are heavy-handed at times. I wanted to scream, ""OK, I get it."" Not a terrible film, but not that great either. If you want to see a more compelling Depp film, see ""What's Eating Gilbert Grape.""",2
"Benny (Aidan Quinn) is the brother of an autistic girl named Joon (Mary Stuart Masterson). He's a bit restrictive and protective of her. Sam (Johnny Depp), the ""quirky"" guy, moves in. Hilarity ensues. So, what's the problem? The moviemakers were not content with making a funny, lighthearted movie. Instead, the movie gets very serious and preachy about several points - whether or not Joon can live on her own, whether or not Sam needs to get a job, etc. These questions are presented as ones with obvious answers, because, of course, love conquers all, as we learn in Hollywood. Sam is portrayed as the truly wise character of the movie, while crazy old Benny is still stuck on backwards ideas like earning money to provide for yourself and caring for the mentally handicapped.There were a few funny parts, courtesy of Johnny Depp, but I wouldn't recommend seeing this movie.",2
"Although Johnny Depp is to be lauded for his deft physical comedy in this romantic fairy tale, it isn't enough to save this implausible film. Depp plays a somewhat eccentric young man who finds himself filling in as a ""housemate"" to a young mentally ill girl who lives with her brother. Mary Stuart Masterson is effective as Joon, and Aidan Quinn does her sincerest best but the film ultimately fails in its ignorance of reality. Julianne Moore has an early appearance as Ruthie, the failed actress who works as a waitress and befriends Benny, Joon and Depp. The movie manages to sugar coat mental illness and we're asked to believe that this obviously disturbed young girl is capable of living on her own. While its message of love conquers all is admirable, the reality of Joon's situation is overshadowed by this sentimentality.",2
"what a boring and pretentious movie! after tortured about 15 minutes, all the family members started to look each other or one another, then all agreed at the same time to reject this stupid shallow movie. depp or no depp, after twenty years, he's still playing the similar roles again and again, and never grows tired of it. but to me, and to us, enough is enough.",2
"This book was okay. It spoke about how gays deal with sexual orientation issues in the workplace. The good thing about it is that it included case studies of a gay black man and a bisexual white woman; so the authors were trying to think about diversity within the LGBT community. However, this book is simplistic and doesn't say much. There are large-scale studies and anthologies out there about gays in the workplace that are more thorough, and just better. You should consider reading this, after you've read all the other stuff on the topic.",2
"Let me just say, I loved the movie Pearl Harbor. But I found the soundtrack to be disappointing. I bought it for the Faith Hill song ""There You'll Be"" If you are like me, I recommend the single.",2
"The so-called soundtrack for ""Pearl Harbor"" is a major disappointment. The film was full of great period songs and music. None of them are on the soundtrack. Instead, you can enjoy an hour of absolutely forgettable, mediocre orchestral background music. OK, the theme song is stirring, at least the first two or three times. But the rest is a real bore. When I want to listen to orchestral music, I go to Bach, Brahms and countless other true pros. Don't get bamboozled by this one!",2
"While the movie Pearl Harbor is amazing, the soundtrack does not follow suite. It begins with a mediocre ballad by Faith Hill and the remaining 8 songs, while nice to listen to, are not Hans Zimmer's best work. Tracks 2-4 are so similar it's hard to tell accompanies the numerous TV trailers. For a 3 hour movie, I them apart. It does not include the powerful music that expected a much longer soundtrack. I'm sure we'll get more music when a follow up CD is released. One will no doubt be released so that consumers who want a better soundtrack have to shell out more money.",2
"I bought this CD for Faith Hills song and hoped the rest of it would be good also. For a movie like this, and an event like this, the music just doesn't fit.There should be some very big, building music here and there isn't. It could have been much better.",2
I was disappointed in this soundtrack. The introductory and final songs were lackluster sentimentality. I would have hoped for something more from the producers. The instrumental offerings lacked excitement and musical tension. I would have though Zimmer would have known better.,2
"Zimmer mostly just rehashes past themes from other films he's done, then throws in a track collaborated on with Faith Hill and some generic period-type music. Big deal. The film stunk and the uninspired score just had me thinking how much better the other films he's worked on were. Zimmer's better than this. The same can be said for most of the directors he usually works with. Perhaps it was just a paycheck to him...who knows.",2
"after last year's majestic score for gladiator, i had high expectations for the pearl harbor soundtrack. much to my dismay, the music no more than ""sorta pretty"". it evokes no feelings like gladiator's worldly mood. plus, with all due respect to mr. zimmer, the defining chord sounds awfully familiar to a Enya song some years ago (i think it was enya). i don't need the faith hill song...... plus, unlike the gladiator score which the listener could visualize the story, the same isn't true with this release of the soundtrack. PLEASE GIVE US MORE MUSIC WITH A SECOND RELEASE!!",2
"Having read Ms. Manning's book, it is obvious that she has somehow managed to overlook perhaps the most important pioneer and innovator of what she calls the ""free energy"" movement:JOSEPH W. NEWMANIt is incredible to me that she could write such a book without including Joseph Newman's long struggle to bring forth his revolutionary technology. Writing such a book without featuring the work of Joseph Newman is as ridiculous as writing a book about the history of aviation and omitting any reference to the Wright Brothers.I would suggest that she view his website videos at:... and perhaps she would discover the essential nature of his successful and innovative technology.Gary",2
"Unfortunately percussion has completeley spoiled all tracks.This is not Bossa Nova,not even Samba.Sorry for a great project with great arrangements.",2
"One month ago (and even earlier) this set was selling for less than half ($41) this current price ($89). While it was a great series that I thoroughly enjoyed watching as a kid, my desire to finally buy it for Christmas has been completely eliminated by the equivalent of holiday induced price gouging. I'll wait till it goes back to a reasonable price. More than a little upset with Amazon over this one. Merry Chri$tma$.",2
Unlike most SciFi shows this show had NO BASIS IN FACT. I must have been much more forgiving as a kid I remembered liking this show at least a little but after watching it again the bazaar story lines and unforgivable scientific inaccuracy I have to give this a total thumbs down.,2
"Not sure whether the original recordings were not preserved well or just our copy is bad, but the sound cuts out frequently on each episode. Would not buy this again.",2
"Even while some of the episodes are questionable and not very realistic, this is a classic show now. Having two seasons, the special effects of the time is still top-notch. While the acting is mediocre, and the story set up is sometimes way out (It was the 70's) there is some entertaining value. As a writer, I still look through this medium to see if there were any parts that can be embellished for newer ideas. What toppled the ratings of this show was the ""Mind"" entity beings that appeared on the first six or so episodes. But after that the writing started to switch to a more action oriented show. I am still looking through the DVD's as I try to remember the better episodes. Quality of picture is fine on widescreen TV's, but this is not an HDTV product.",2
"I found the book to be very general and basic. Most of the information I already knew. There are methods of retrofitting old windows I have seen on home type programs that lightly discuss these topics and which the book does not. Also, the book could use a lot more diagrams and discussions on finishes and paint. The book limits itself to actually restoring to original working condition old windows and nothing about updating. This book is for beginners except that for beginners there should be a lot more pictures. I did find some good tips but not the information I was personally hopeing to find. I am selling the book back.",2
Goes a mile wide and an inch deep. I would rather the same book but each chapter by an expert in that area with a lesson/example.,2
"The FM stereo does not pick up well at all. I cannot get many local stations. The description says it uses USB 1.1 for quick transfers. This is misleading advertising. USB 1.1 is the slower transfer method. USB 2.0 is the faster one.Where this device excels is in conjunction with a MP3 player. The rechargeable battery means you can use it away from a power supply for a long time. The sound is excellent.This would get 3 stars due to the slower transfer speed, false advertising, and poor FM. It gets 2 stars because the price is too high for a refurbished model.I got this for $19.99 directly from Philips web site. I would check there first.",2
"Ok, so I have not actually heard this WHOLE cd. I did hear Bob sing on The Bachelor show and was impressed, but then I heard ""his"" first single, Girlfriend, and was less than impressed. This is for two reasons: a) Bob doesn't really have the rock vibe, which just makes his version of Girlfriend sound wrong (in his defense, the song I heard him sing on tv was Open Arms by Journey, an excellent song, and not easy to sing I don't think). b) I can't deal with the fact that I have not heard Bob publicly credit the originators of the song Girlfriend. The July For Kings version is 100 times better than Bob's, and while I know the band probably appreciates the publicity, they are not getting all the credit they deserve. Check out JFK's cd ""Swim"" and make your own comparison, though if you like Bob's single this CD will likely not disappoint your tastes.",2
"I kinda liked this book for awhile. Some strange humor and interesting to see what is was like to travel at the time of Twain. I thought it was a litte long and boring and though (only read 3/4 of it). Not very exciting and a lot of quotes from other esoteric sources. Also, he makes reference to Arabian nights while in India. Aren't those stories set in the middle east and north africa? (kinda lame)",2
This was a great deal if it had worked. The gas regulator had leak by when set to zero. Amazon was not good about sending a new one they said the price had gone up and I would have to pay the new increased price. I just got a RMA and returned it. Could not get the seller on the phone. Tired of messing with it went to welding supplier and bought new. Some things just should be bought locally.,2
This product does an adequate job of cleaning your feet and does provide some relief for tired aching feet !,2
"I pre-ordered this foot massage spa to relieve niggling pain in my feet. Though the product operated exactly as per the manual, it was rather tame. It didn't really help reduce the pain, rather it merely tried to soothe the feet. Your feet will feel good so long as they are in the spa, but the spa does nothing to reduce the pain. I didn't think its worth spending so much money to just put my feet in hot water (& that too without salts). I've returned the product.",2
"Bought this unit directly from Brookstone over 6 months ago. Was initially great very hot water and jets were comfortable but stopped working after 4 uses. Brookstone would not replace because after it was after ""limited"" warranty coverage. This was an expensive unit and not sure if I would get another one from Brookstone or try cheaper model that hopefully won't break down.",2
I loved the idea of this foot bathbut the product leaked. Brookstone was great to work with for the return.,2
"I purchased this item thinking what I read about it here on Amazon would be true. Unfortunately the heated foot bath and Message is not what it sounds like. The heated part works ok, but as far as the message part, not even close. And the jets, come on, give me a break. For what I paid for this, over $100.00 and the most expensive one that Amazon had at the time I thought I would be getting a good foot bath. If I had to rate this from 1-10 I would give it a 3. Only because it does keep the water warm. In my opinion it is not worth the money or even half of what I paid for it.",2
"Bought this thing as a gift for my wife. She was really excited to get it. Used it twice, with out any salts, and it worked great. Third time she went to use it, the jets didn't work. Got a hold of the company who sold it, and they said no problem, just send it back. So I'm thinking they are going to send me a new one, that works. Made me pay the return shipping, and just put the money back on my credit card.If I sold a defective item to someone, I sure as hell wouldn't ask them to pay for return shipping.",2
"By the time this 9th entry in the Jason Voorhees franchise was released, the series had become tired and ultimately redundant. In an effort to put more life in it, we are faced with a Jason who is killed but like in THE HIDDEN (a far superior film), he manages to live using host bodies. Although the screenwriters try to give us more motivation for Jason's murderous rampage, there is little suspense or novelty in the movie. Jason manages to kill off a few people, and his sister is recruited to finish him off. No real acting honors in this one, although Steven Culp manages to do well in his role as a tabloid tv producer. The ending is a joke in itself, with its reference to future Jason adventures. Not the best in this series.",2
"I cant beleive they did this, they added a crapy plot, ""only a vorhees can kill a vorhees"" WTF??!!!!???!! jason had a sister? what a stupid plot, then at the end you see freddy's hand grabbing jasons mask and pulling it down under the ground (telling me freddy vs. jason is next).if you want to collect the friday the 13th film's i sugest part's 1 2 3 4 5 6 7 8 and X.",2
Yes part 9 or Jason goes to hell is a classy entry in the series.Jason's soul jumping from one body to the next might seem ridiculous but they have tried everything else.,2
