comment,star
"We recently purchased a 1934 Spanish Eclectic that needs not only restoration of it's former architectural integrity, but an addition to make the home work for us. This book was a good choice to provide us with a photographic ""library"" of Spanish-style homes to reference. I do wish there had been more devotion to the ""casitas"" section of middle-class homes and less to buildings dedicated to government or business; and perhaps more photographs of interiors. But it's still a great find and a wonderful addition for anyone who collects either books on architecture in general or on California architecture specifically.",4
"Hard to find these days, but worth picking up. Lots of hidden goodies on here. Can't go wrong with Sepultura's ""Chaos B.C."". And the run from Crawlspaces ""My Ruin"" all the way up to Cubanate's ""Oxyacetylene"" is full of awesome. Alien Factory's ""Higher"" is one fast paced track that fits at home at any rave. And Crystal Method's ""Come2gether"" is good not matter what mood im in.If you avoid the warts (Like G/Z/R's 'Outworld'), you have a good time with this CD.",4
Timely service and as described. I really prefer to know the editions publish date as I seek issues from 1999 and newer if possible.,4
Escape from Alcatraz depicts the full history of this infamous prison stronghold. It reflects how life was on the Rock and details the circumstances when and how 23 convicts attempted or succeeded in escaping from the island prison - the latter few never to be ever seen or heard of again. If you are interested in Alcatraz you need go no further than reading this book - it is really that good !,4
This is a beautifully conceived and photographed book of faces of people of mixed races who are wholly American. On the facing page is a handwritten paragraph of how they see themselves. It's wonderful.,4
"Great book -- I just wish it was longer! I gave a copy to my sister, who has two daughters adopted from China -- so although her kids are 100% Asian, it is likely she will have Hapa grandchildren. I also gave a copy to a friend whose husband is from the Phillipines and has 3 beautiful Hapa children --- they liked the book so much, they bought copies for their children and grandchildren. Beautiful photography, and wonderful insights into being part Asian, 100% Hapa, in an anglo world. My favorite quote is from the boy who said he is 'part Danish, but I usually don't tell people that because they think I am a pastry'.",4
"I am 100% Hapa, i was born and raised in Hawaii and i am very familar with the term and pleased to see it making its way into mainstream culture. I bought this book as a fathers day gift for my husband who is always asking why our first son looks nothings like him (he is Irish) and i am Hawaiian-Irish-Portugese.I only wish that the title of the book was more inclusive of Hawaiian and Pacific islanders who are also Hapa and originated the term.",4
"This mirror fit our mirror frame perfectly; however, the first time that door was shut it fell out and shattered. We used the adhesive system that came with it. Next time we'll use gorilla glue instead!",4
"The book overall is quite out-dated but it's message still has a singe of relevance. While world history is a fascinating subject, the history of your ancestors is even more fascinating. A powerful message that should not be forgotten.",4
"Before picking this book up to read I was aware of the knowledge I needed on African American's in the Education system. After reading it I felt empowered and sad. Empowered because now I had a little more knowledge and saddened because now I know what was kept from me all my school years. It amazes me how we were not taught any of our history not even in college. It also amazes me how people got away with not educating us.Dr. Carter shows us how 30 years ago the system was designed to keep us ignorant and as experiments. Quote from Dr. Woodson ""Negroes, being objects of charity, have received them cordially and have done what they were required."" To this day they are still using the same system but I think we are smarter now and know where the resources are to get what we need.Reviewed by Missy",4
"I am a twenty-four year old African American man and I read this book six years ago, and even at that young age I found it ""On point"". Dr. Woodson wrote this book over 60 years ago and his observations of social and educational conditions hold true to this day. This book was my introduction to my continuing studies of African American history, and I recommend that anyone beginning their studies begin with this book. There will be many instances when you will nod your head in agreement with what is stated, and other times when you will learn things about your own behaviors that you could not previously understand. The only reason that I couldn't give this book five stars is because it is a scholarly text and it is a little difficult for less sophisticated readers.",4
"The negative, incredulous readers/reviewers should read Psychiatry: The Ultimate Betrayal by Bruce Wiseman as the companion to this book. It very well may change your mind about your opinion of this work and others like it.",4
I stumbled upon this book while researching a different subject. Wow! Everyone should read this book. So enlightening. People of all educational levels will benefit from the wisdom of Mr. Woodson.,4
"I found this book to be very informatative and I was pleasantly surprised by all the valueable information that was within the pages of this book. What impressed me the most was the wealth of information concerning the African American people, especially the male gender. I brought this book because I am studying the Hebrew roots of the Christian faith and this book has clarified many questions I had about why we such a hated race of people. I wish I could buy this book for ever black male and female who is not proud of who he or she is because of a lack of knowledge of our heritage, which has been stolen from us way back in the 1600's which is actually 15th century and has been replaced with the Europeans. If you have no identity than you will become what others say your are. This book should be taught to every black elementary student as a History course so that they will come to know who they really are and where they come from.",4
"Overall, the HomeRight Auto Wash Stick works well on flat surfaces but if your car has wheel well mouldings, fender flares, spoilers, air dams, roof racks, or just about anything not flat, I find it hard to get those areas. And many places can't be gotten to no matter what. It earns a 4 star because where it can be used it works pretty good. If your car is an easy car to wash then perhaps you will really like it. Mine is a hard one to wash so when I get done, I let it dry then go back and wash the areas I missed by hand. Even with that, it's still easier and quicker than washing the whole thing with a sponge. Plus the long handle makes it easier to do the roof without stretching or reaching and the lower areas without stooping. It feels a little light duty and I worry how long it will last, but if it holds up well I would probably buy another.",4
"The backing for the mitt has a slight curve and fairly soft flex that does a surprisingly good job on and around door trim. Uses more washing solution than hand washing, but that is the only negative.",4
This puzzle was an impulse buy. But was well worth it. The pieces are large and on knobs so my little one was able to use it easily. There are only three pieces so its easy to store and keep it all together.,4
"This is a good first puzzle. It is great for practicing fine motor and hand-eye coordination. Also, my son is 12 mo. old and likes to chew everything. This puzzle is sturdy and he doesn't chew away the pictures!",4
"I purchased this product 2 years ago and still use it now and then. The smooth rollers are comfortable to grip w/o over heating your hair and fingers. The rollers form a medium curl and the clip helps smooth out frizzies. I give this product 4 stars only because the clips do not hold tight enough. I find them easy to loosen or fall out even if I am sitting still. I have long, thick, wavy hair so the roller clips may hold thinner hair better; although, that may be the ones that end up with the crease.",4
"This is perhaps the 5th set of electric style rollers that I have owned. It's probably the best, in that it heats up very quickly, which is, after all, why I use this type of product. It also has the same flaw that most electric rollers have, which no fool proof way of fastening them so that they stay in the hair. This product has a squeeze clip that fastens over the roller, once it is wrapped with your hair. It also heats up, to transfer heat to the hair from both the inside and the out. It also will leave a ""crease"" in the lock of hair, from where is clips on. No way to avoid it. I use the rollers along with a curling brush, to smooth out the crease in the front, which fixes the problem for me. Meanwhile, if you use electric rollers in general, this set is quick, and delivers a firm curl in a reasonably short period of time.",4
"I love this! Works great and is so easy to use.The big selling point for me is IT HEATS UP FAST! My old unit takes FOREVER to heat up. I just can't wait that long in the AM so I haven't used it for a long time. This heats up in less than 2 minutes.There are more than enough rollers for my hair and I found it easy to wrap my hair around them. My hair doesn't snag on these rollers at all. The clips hold my hair perfectly and after about 10 minutes I take everything off, I spray my hair and I have a head of beautiful bouncy curls.And this thing is going to last for a long time as it's very well made and high quality.But, there's no way I can keep it on my bathroom counter. It takes up a bit more space than I have free. So, I set it up on a shelf and that works fine.I appreciate having a space in the back of the unit for the plug. No more dangling cords!I'm really happy with this.",4
"Anthony Robbins is a powerful presenter. And he has a lot of practical good advice in these CDs. They are a bit pricey but...I found it useful to play each CD twice, really absorb what he is saying. I also try to go back every two or three months for a refresher session. And don't forget to keep the daily journal he recommends.If you are serious and put in the time, it will help you. It's a way of life not a one shot experience. It takes practice and commitment to implement his ideas, to succeed.So what else is new?Bottom line: this set is a useful self-improvement tool. But be sure to devote the necessary time to incorporate the ideas into your thinking and your actions.Good luck!",4
"Use to like him when I listened, is good for getting you fired up. Not sure what to think of him getting divorced after all his marital bliss. Oh well its a concept that if you stick with some good things may happen!",4
"I loved this product for a while, but now my baby who's just over a year pulls them off any surface and I keep having to press them back down and try to distract him from pulling them. Still preferable to the restaurant table surface though.",4
"This book provides introductory passages that illuminate the art of Tai Chi Chuan, and set a beginner on a path to cultivate internal energy. Translations of famous masters take up another chapter. The book covers all of the major styles, although the illustrations for each form(except for the simplified form) are probably meant for informative purposes only; they're not detailed enough that the reader could learn the form from studying the illustrations. Including chapters on martial applications, further combative situations involving the gentle art, weapons, meditation and Taoism, this book is probably the most thorough Tai Chi Chuan book out there. I highly recommend it.",4
"I got this cd player because I had such a hard time finding lullibies on tape. I had read the other comments but thought I would give it a try anyway.Bad points- It DOES skip when its hit, so don't hit it. The light IS dim, so what? I want the kids to sleep not see what to get into! The music IS low even on the highest setting, but then again the whole house isn't listening to it.Good points- It plays the whole CD then shuts itself off. (At least mine does!) It uses CDs which can be found ANYWHERE. Its small enough that I can put it on the wall side of my crib and I know my other children CAN'T play with it!! The buttons are a pain to get to, but thats GREAT where kids are concerned, right??As for the batteries, I've had mine a few weeks, play it EVERY night and have yet to replace the batteries.I happen to really like mine. Give it a try, save your receipt and make up your own mind.",4
"I really like this CD player. I do not understand why it has such a low review.*Yes the light is dim but I did not want a bright light. It is a nightlite. It is just fine. I can check on baby and see him fine.*The volume does not get very loud but for what this is designed for it is fine. I put in a lullaby CD and he drifts off to sleep.*The timer function if great.*The only reason I did not give it 5 stars is that I wish the digital readout and the buttons lite up. It is hard to see in the dark and I do not like to turn on the light to see the buttons and digital read out. Maybe in the next version the manufacture will include this.*As far as the CD's ckipping when hit, I solved that by sliding a piece of foam between the play and the rails of the crib. No there is no space to move at all and it does not skip.***It is not perfect but it does the trick!***",4
"I love my cd player. My baby uses it every time she goes to sleep...at night and for naps. I like it cause it shuts off itself. I gave it 4 stars cause I wish it would play louder,...but it truly is worth buying!",4
"Even tho these crib CD players were manufactured quite a while ago, they are still available; I bought mine at a Goodwill store. It was wonderful when our grandchildren were in cribs, but they still enjoy it when they come to spend the night. I guess it never occurred to me that an infant would need stereo sound. The volume level is sufficient for an child, since the idea is to lull the baby to sleep and not to ruin the child's eardrums. The nightlight is just enough for a child to feel safe, and yet not bright enough to keep him/her awake. Yes, it is difficult to replace the batteries but as any grandparent can tell you, if something is hard to open, give it to a child. I wouldn't want it to be easier, for safety reasons. Our 6 yr old granddaughter is staying the night and is thrilled that I found the missing CD player which I can hook onto a standard headboard.",4
"My husband and I wanted to buy this for our kids to play the lullabye CDs people had given as baby gifts, but we couldn't justify paying $50. I happened to find a used one at a rummage sale for a dollar! Much more reasonable.PROS: plays any CD; good volume control for a crib (a baby doesn't need surround sound to fall asleep); battery compartment is secured well; ""C"" batteries are best as rechargeables for something like this, since it's used every day; optional timer and programming buttons are good to customize baby's routine; dim nightlight is just enough for you see where the pacifier fell while you reset the music in the middle of the night without waking babyCONS: PRICE; CD door takes two hands to open and is noisy; I kind of wish it had a optional wall-mount or desk base for post-crib use",4
I really love this player; the light is just right for a baby; the sound is very good;I can hear it playing in the baby's room from my room at the other end of the house. My only complaint is it is hard to open but in a way that is ok too; we don't want the baby playing with it! I highly recommend this item. I may have to buy another because my 8 year old uses it after the baby is asleep!,4
"I really dont agree with the other reviews on the cd player. I can hear the player on high from a good distance and really only use the player when she is going to sleep, so how high does it have to go? I dont keep it on high as not to keep her awake, and the only issue is the light doesnt shine as bright as I thought. I keep it attached to the crib not near her head either.I dont get what the other reviewers dont get. Mine works great",4
"This book is good at first part, which provides the basic understanding on cryptography. But it is not understandable for the second part on modern algorithms and public key. I still cannot understand the advantage of modern algorithms over the ancient cryptography.The chapter Key Management seems to long for such a small issue, while the modern algorithms seems to short for such a big issue.",4
"If you want an accurate introduction to the concepts and vocabulary of cryptography, this is the book for you. The authors are clearly knowledgeable but manage to make the information provided accessable to the beginner. There are simple examples to acquaint you with some of the principles of coding and breaking codes. This is a complex subject and some of the ideas will take you into deep water. There is an excellent bibliography that one can refer to for more technical details. The book would benefit from a glossary of acronyms as some of the terminology was hard to keep straight. There could have been a little less discussion of key management. Over all a very useful and informative book.",4
I bought this for a christmas gift.The dvd was a great deal with good reviews so i purchased it for my brother.,4
"I always drives me CRAZY when CD & DVD music videos don't include the songs on them. So, here's the List...Nickleback ""Live at Home""Tracks:1. Woke Up This Morning2. One Last Run3. Too Bad4. Breathe5. Hollywood6. Hangnail7. Worthy to Say8. Never Again9. Old Enough10. Where Do I Hide11. It Ain't Like That12. Leader Of Men13. Mistake14. How You Remind Me",4
"My 2 year old called this a dino and not a dragon and doesn't relate to wood stoves, different era I suppose. But from the first day he reads this 5 times in a row so it must be fun for him. I don't love that ever since he asks for milk and cookies at night...",4
"My four year old enjoys receiving Ladybug magazine in the mail. It has sweet little stories and is somewhat entertaining. However, he much prefers National Geographic Kids and High Five. Not sure whether it's the nature of the content or the style/layout, but it's not the biggest hit in our house.",4
"We just got our first issue of Ladybug Magazine. My 2 1/2 year olds enjoyed it, but I think some of the stories in there are for older children, probably a year older than mine are. That said, the publisher does give a range (2-6, I believe)and I do think that the kids will grow into enjoying all the features of the magazine. Its nice to have something other than Highlights, which the kids also enjoy.",4
I am a primary teacher and I was looking for books to use with my higher readers. This series of books was suggeted to me and I am very thankful. My first graders love them and I am working on buying the complete set.,4
"A group of kids awaits a book signing with their favorite mystery author, Wallis Wallace. But the author never shows, and the kids find it strange. As they follow clues, they think Wallis Wallace has been kidnapped.I like this book because it's pure kid imagination. It's what kids wish would happen. Who didn't want to be part of a mystery crew like on Scooby Doo or this A - Z Mysteries crew? The start to this series is imaginative, fun and keeps you interested.",4
"The best part of this lens is that it is stabilized and f/2.8. I can take had held shots at weddings regardless of the lighting.The downside is that it is not nearly as sharp or high quality as a L lens. It sucks a lot of dust inside which doesn't affect the pictures but could eventually be a mechanical issue. It is not sharp until around f/8 and does not handle contrast or vivid colors as well as L glass.I would recommend buying this if you need to take hand held shots with a zoom, in low light. Otherwise buy a L or a couple primes.",4
Overall it's a very good lens butts for the price make sure you really look before you buy these lengths I'm not upset that I bought them because I do video shooting but for that money it's not worth it it got better and cheaper lens out there that gives you the same type of quality,4
"I am very pleased with this lens. Last week I took approx. 700 pictures on a trip to Iran, mainly using this lense. The IS, together with the f/2.8 makes it a very good indoor lens. I some of the museums you are not allowed to use flash; this lens is solving that problem.I believa that the softness I expire in the photos is because of my D40 camerahouse, not the lens.What I am missing:- the weather-proofing you get on the L-series- the Lens Hood should be a part of the (expensive) lens- A pouch should be a part of the (expensive) lens",4
"An alien race on the brink of extinction devises a plan to resurrect human corpses in ""The Second Soul,"" with Mykelti Williamson; Ralph Macchio is a former child prodigy who uses a computer to allow comatose patients to talk to one another in ""The Other Side""; a murdered doctor is given a ""New Lease"" on life when he's brought back from the dead to track down his killer, with Jason Priestley, Stephen Lang; a scientist develops a drug that challenges a futuristic society's anti-emotion laws in ""Essence of Life,"" with Joel Grey, Daniel Baldwin; a soldier participates in a series of life-threatening tests in order to be assigned a top secret mission in ""Human Trials,"" with Jason Gedrick; and the only person who knows the location of a devastating biological weapon is being kept alive on life support inCategory: TVCast: Daniel Baldwin, Jason Gedrick, Joel Grey, Stephen Lang, Ralph Macchio, Ron Perlman, Jason Priestley, Mykelti Williamson",4
"Heinrich Boell's ""Ansichten eines Clowns"" is a fresco of postwar Germany, a very different landscape than today's. Boell's generation were tortured by remorse - and justly so; remorse humanized them. This is a novel about pain, loss and ethics: individual ethics and collective ethics; about how Hans remains faithful to his beliefs to the bitter end, about how Marie takes the path that she has to take. Together with Guenter Grass's ""The Tin Drum"" (published four years earlier), the ""Clown"" is the greatest novel of the Erhard period.",4
As a layperson I cannot comment on the accuracy of the translation but it reads elegantly and the ethos and sometimes pathos of the writers are blatantly palpable. They can be read aloud easily as they most certainly were intended for such a purpose. Two of the writers (Clement of Alexandria and Ignatius of Antioch) quite likely had direct contact with the original Apostles. The Didache may predate the gospels. In any case this collection gives a good glimpse of Christianity at its very early form. Essential reading indeed.,4
"Very good introduction to the writings of the apostolic fathers. However, I feel it was a major oversight for the author and/or publisher not to include the Epistle of Barnabus and Shepherd of Hermas in the book since these two documents are crucial to the study of early church literature. Apart from this obvious mistake, a very good book.",4
"Swindoll is always a gifted writer giving special insight to the reader. ""Esther"" brings to life the struggles and emotions one faces in life's difficult situations. Esther reflects poise, strength and courage in the midst of trials. This is an encouraging and one the most thoughtful accounts of Esther that I have read.",4
"Having ordered this book as ""new condition"" I was disappointed when it was delivered and all the corners were slightly bent. I don't mind that it was only slightly damaged. I do mind however that it was advertised as ""new.""",4
I love this case! I had recently cracked the entire back of my phone due to having a non- protective case on it. I ordered this otter box because it’s cute but also provides protection. It fits my phone perfectly and is very comfortable to hold. It has protected the camera in the back and is very durable - I don’t even have a scratch on it yet!,5
"I’ve been through a few phone cases for my iPhone 14 Pro Max and haven’t found one that fits it well (particularly around the rear facing camera)…until now! I don’t understand how so many different cases don’t fit something as popular as an iPhone (especially in the exact same place and way). The magnet is the right amount of strength too, not at all weak so holds on to my car mount, but easy to remove if you are intentionally trying to remove it from a mount or charger.",5
"I love this phone case. It’s not bulk or slippery and I love the shimmer. I also use a metal magnetic mag safe pop socket and it sticks amazingly. I’ve dropped my phone several times with this case on and it protects it. Otter box is great! I just bought a new one to replace my old one, which was about a year and a half old. They last a long time but it will yellow over time. I recommend replacing once a year to keep it looking clear and pretty.",5
I love this case! I had recently cracked the entire back of my phone due to having a non- protective case on it. I ordered this otter box because it’s cute but also provides protection. It fits my phone perfectly and is very comfortable to hold. It has protected the camera in the back and is very durable - I don’t even have a scratch on it yet!,5
