comment,star
HDD Enclosures are always confusing as there are so many available in the market with so different ways of connecting peripheral/auxiliary devices. I went through a large list of HDD Enclosures and after couple of days purchased this item - waited for couple of days only to find out that this enclosure does not fit my internal hard disk. The board had some soldering blemishes but never had a chance to test the connectivity. The build looks pretty ok and it was a great ide to include the screw driver as part of the package - It was really helpful. Be sure of what Hard disks you are using - SATA is common these days. I ended up buying a SATA to USB cable that served the purpose of transferring data from my old hard disk to a newer one. This product may be good for the price advertised but ensure that this one serves the purpose. This would fit only HDD of laptops cos its 2.5inch and would not work with the bigger solid state drives - the ones which are normally used for desktop,3
"The device works, but you have to be careful with it. The IDE connection is not very deep and doesn't seem to be reliable. On the top of that, IDE connection is the only thing that hold the drive inside the case. While I am moving around with enclosure, I can hear the hard drive rattling inside.The Enclosure is OK for the stationary setup, but would not work for any mobile tasks.",3
This product is not for you if your going to use this as you primary portable hard dive. The only use for this enclosure is to retrieve data from another HDD.The solder joints are weak and look like their about to break.This product is not going to last very long so get a this is not for you if your going use it long term.,3
"Apparently, not all 2.5"" laptop drives are the same, or perhaps what i have isn't exactly a 2.5"" drive (IBM Travelstar, DCXA-210000, out of an old Dell laptop(?)). It didn't fit in the aluminum case... real close, but no cigar. Maybe if this drive had ever so slightly rounded edges along it's length it would fit.Fortunately, this is acceptable for my needs. It electronically edge-connected to my drive & provides the USB2.0 interface, but i do have to leave the drive out of the case, naked / exposed. O-well. 'Works.Karl*----->",3
"First things first, this enclosure is not blue, as listed. It is silver, and looks very similar to my other enclosure, which causes me some confusion, and is why I bought (or attempted to) a blue one.Otherwise, it works fairly well. Can get a little hot since it lacks fans, but keep it off of any insulating surface and it's fine.",3
"it took me a few extra minutes to plug in my drive and the usb cable came with the drive didn't work at first, but I figure out that problem and now it works great. Quiet, fast and slim.The vendor sent me a replacement usb cable no extra charge.Thx.",3
"As an enclosure, it seems to work fine. I knew it was cheap; we'll see how it fares over a period of time.My only quibble is the cable. I don't mind the Y-cable for use with computers that need the extra connection for power. It's the fact that the cable is a nonstandard USB A-A. Almost every other USB drive is A-B or A-mini B. Why does this matter? Because if you lose the cable, it'll be a hassle to replace it. As a consultant I have a lot of external drives, and don't want to worry about keeping specific cables with specific drives.",3
"Well, i have had it for a while and it was working. But then my computer suddenly stopped realizing it was even plugged in. So i tried another computer, and then my laptop, but nothing. I think it may be the driver, but I am just warning you people that you need to be careful.",3
"This drive works as advertised, my issue comes from the fact that the connector on the drive is a USB A connector. This makes things a little tough if you lose the cable - because it isn't easily replaced with either a mini or micro USB end, or the standard USB B connector. I doubt I'll get another one - though once connected it did work as expected.",3
"Like the title says, it does what it needs to and nothing more. I had to et one of these to do a data recovery from my brothers laptop.The case itself is well designed accept for the back plastic cover. It will take some jimmying to get it back on once the harddrive is installed in it. BUT YOU CAN DO IT.Also, don't loose the original usb cable. Its not proprietary but its a cross-over USB.Performs as expected and costs almost nothing compared to the alternatives I've seen in the past",3
"Works fine with Windows XP but unfortunately I bought this to access data on my old drive from a computer using Windows 7. Windows 7 says the drive is invalid and only give me an option to format it. Odd too since the data on the drive was all created in Windows 7. I have not yet tried that because I wanted to pull some data off of it first. I had to connect it to my work computer that uses Windows XP and share over the network to pull data.On a side note: this comes with a USB cord that has three plugs and no instructions at all on which one goes to enclosure, which one is supposed to plug in or if it even matters. One of the plugs is longer and thicker my guess is that one is for USB ports that are further away from where you want to put the drive but then I don't know since there are NO INSTRUCTIONS.",3
It has teenie-tiny phillips screws to hold in the top. Had to stuff some folded paper down inside because the case is longer than my HD and it kept sliding back and forth. The did supply a little phillips driver for those screws but the head of the supplied driver was way too big for the screws. What a joke. It worked once mounted and modified but it should have some foam or something to account for different length HDs and some click-in type of mounting instead of screws like those that are in your glasses. These screws are going to get lost and screw into plastic directly so eventually will strip out its socket. It does have a nice slip-in case and sleek color.,3
"This product was easy to set up and install. With a DVD it has pretty good surround sound and appears to be well balanced. The wireless rear speakers work well. One feature which was suprisingly missing, however, was the ability to connect the sound from your digital cable box by means of a fiberoptical connection so that you would get true dolby when the show is broadcast in dolby 5.1.",3
"This book provides examples of how to do certain special effects.It was definitely more of a ""tips and tricks"" book than it was a learning resource. Just follow the steps, and go ""WOW"" just like the title.It doesn't really explain in detail how the trick was done and why you're doing a certain step. Most photoshop gurus will just scoff at this book, and most newbies will walk away amazed, but no smarter about photoshop than before they read it.The latter portions of the book was nothing more than a summary of the different photoshop filters found in commercial filter packages. I question why thoese filters were even in the book; it seemed like advertising that does not benefit the readers.",3
"I absolutely loved the anime of Cowboy Bebop. This book is set in the same universe with the same characters. Their stories, however, have changed. The way we meet Ed, Faye, Ein, and the history of Spike and Jet are different based on the author's take on the characters. Some might not like this, but I like the new twist on their relationships. Plus the author has added a whole new badguy! Since the TV series is over, it is also like getting all new Bebop stories. I haven't read the rest in this manga series so I don't know how they continue, but if you are dying for more Spike and don't mind the alternate reality, I highly recommend the book!If you don't want the stories to change, consider picking up the Cowboy Bebop series by Hajime Yadate and Yutaka Nanten, ISBN#1931514917, simply called Cowboy Bebop Book 1 etc. These are more like continuing adventures that take place in between what would have been a TV episode.",3
"This book was ok, but I was hoping for more. It's really just goes into the specs and options for each model. It include's production data, units sold, etc. and tha's about it. Pretty much just the facts...",3
"This is a great textbook, very comprehensive information on the subject, the the writing could be clearer. It would be hard to make this subject into a page turner, but in this book it's sometimes difficult to pick up the relevant information because the writing is so dry.",3
"i've read 100 prophecy outlines. this one's good. it's an encyclopedic, a-z style outline. takes a while to read from beginning to end.",3
"Title says it all. Wasn't real impressed with this particular solo CD. I love his other solo work & keyboards/violin with UK. Actually got to see UK in a bar room In Baton Rouge, LA. The audience might have been 300 people max. Very intimate setting & excellent music with prodigy prog. musicians.",3
"i like RBL and Black-C a lot. Taydatay is my favorite from 11/5. So this combo made me expect a lot. Production is not as great as I would have thought, but there are some cuts (at least a few from black c) that dont sound too rapmaster keyboard-drum machine style. I liked the title track w/ big mack. taydatay/big mac collabo album would be good. as i said, the lyrics overshadow the production- sean t (he did this title track), ric roc (its hard 2 b-legit) have the best in the bay right now..",3
"I have to say..I just started using this series and thus far, the written portion is great! But how could I have known it required a very expensive CD? I sure wish that part had been stated before I ordered this series.",3
"Offutt's strength is his prose and characterization, but his narrative is a little off here. A shame really, because his first memoir was solid all around. He himself admits to not knowing what the Holocaust story has to do with his own return to Kentucky and, quite frankly, neither do I. It seemed thrown in as maudlin filler and was blatantly incongruous.The ending seemed rushed too. ""I am saying good-bye"" and ""I want to stay. I am ready to leave."" I know he can do better and the rest of the book proves that he can do better.Still though, there are some stylistic gems here. Offutt uses words and characters wonderfully. You'll love them and understand them. He's a very solid writer and students learning to write creatively can learn a lot from his craft--overtly and subtly.Worth a read.",3
"Three stars may be generous for the game. There is really only one way to consistently score: take the ball right to the hoop while using the ""juke"" moves. Short range jump shots don't work. Post-up game: forget it. Anything resembling a real basketball game: forget it. But if you do take the ball to the hoop and use the juke moves and you have one of the star players it is unstoppable. Play LeBron: he'llo score every time. If you like a pure arcade-style game then you might like this one.",3
"I heard Neil say in an interview many years ago that he was going to write a book someday, eight years later I was excited to finally find this book. If you're looking to read a book about Neil the drummer or Neil the musician, you will be sadly dissipointed. If you want to learn about his passion and desire read this book. If your not a cyclist you might not find this book is for you.",3
"Barbarian was a better film, a feast for the eyes, great acting etc, but Destroyer is more humorous and is worth watching for the Princess alone! A bit corny especially in the Wizard scene but all in all a good fantasy film",3
"Conan the Barbarian is back in CONAN THE DESTROYER, 1984 sequel. Without going into a long review, if you liked the first one, rent this one- but chances are you won't be pleased. CONAN THE DESTROYER (1984) Rated: PG (Fantasy Barbarian Violence) 2 1/2 stars out of 5.",3
"Among Arnold's early movies, this one stands out for the eclectic supporting cast. His early movies were remarkedly free of any acting on his part; I suspect he was still learning English then. But one way to make him look better is to hire nonactors, or miscast semiactors. Enter Wilt and Grace. (Later, Richard Dawson). This is as much a collectible as Terminator 2.",3
"""Conan the Destroyer "", this disappointing sequel to the entertaining and well made ""Conan the Barbarian"" is an example of what happens when studios attempt to broaden the appeal of a movie for younger audiences. This movie tries to inject more slapstick humor and includes ""big name"" stars (Grace Jones and Wilt Chamberlain), while sacrificing much of the story line, effective characters, and raw action that made the first movie so watchable. The special effects were also weaker and often seemed out of place, making this a real step backwards.If it wasn't for ""Arni"", it wouldn't be worth the price of the DVD. Recommended only for die hard Conan and ""Arni"" fans.",3
"After the succesful Conan The Barbarian the inevitable sequel took part 2 years after the first.This time Conan the Cimmerian(Schwarzenegger) must find with the help of a virgin princess a jewel that leads to the horn of a god Dagoth which a evil queen(Douglas) needs to give to their kingdom all the power of the world.Followed by the sorcerer of the first film(Mako) by a cure thief(Lester) and a agile warrior(Jones) they must face all the dangers of such a risky mission.With dign special and visual effects and the final monster made by the creator of ET the film has a whole dign production better than italian imitations(Ator) or cheesy and camp productions(Red Sonja,Barbarian Queen) and at least is entertaining and pleased to watch.",3
"The last batman movie was great, this was plain ordinary. Overrated and far too generously reviewed.",3
"this blu ray its anything you would expect i recomended and people should buy the box set too, thnkx e",3
"Had eagerly awaited this one. Great movie, but the image quality was in no way up to BluRay standards. Not having seen it in the theater, I don't know whether this was by design.That said... Oscar-worthy.",3
"Everybody knows the movie is fantastic, and I'm sure the transfer to blu-ray is equally as impressive, but I received this product with a giant puncture mark through the case. There was no damage to the box, so I assume it had to be due to how the movie was handled in the warehouse. It literally looks like somebody attacked it with a screwdriver. Luckily it didn't damage the disks, but regardless it's still annoying.",3
I absolutely love this movie. I hate paying $25 for blu ray discs though as even with my top notch equipment it's just not that much better. I already have two versions of the dvd.. yeah i like it that much and wanted the blu ray basically cause the price was right. However i was disappointed as when i got it there was a golf ball type divet in the blu ray which wouldn't allow it to play. I unfortunately had to return it. I am giving this item a 3 star for midway though because i received fast service and it was extremely easy to return at no cost to me.So yes quality control sucked that this got out as it clearly couldn't play for anyone but Amazon customer service support was top notch for returns.,3
"I wasnt planning on watching this movie but decided to last minute. I saw it on the huge screen at IMAX.. special effects and action was great.. heath ledger was fantastic in the role as the Joker.. i had only seen him in romance and drama roles before this, but he really suprised me with this one. He really went out leaving his mark.If you're not a fan of his, or of the Batman series, you might not become a fan from watching this movie, but i do recommend giving it a chance at least. Its a pretty good storyline and even a bit scary towards the end.. i only bought the dvd for a friend, but i wouldnt mind watching it again.Definately watch it if you're a Heath Ledger fan though.. he was awesome in his role and you will love him in this one.",3
"This was a solid movie, but way too long. It was as if they kept putting in another scheme for the Joker to pull off...then another...then another. Why? They could have cut 30 minutes from the movie easily.I have to say that I was expecting much more from Heath. While his performance was certainly solid, it was by no means the oscar winning portrayal I was hoping to see. And for him to have said that the role was so disturbing that it was causing insomnia and a lot of his problems--he clearly had some emotional issues then, because the Joker was actually a lot more tame that I thought he was going to be. All in all a solid movie, but it was too long and over-hyped.",3
When i hit the play button i watched so horrible video quality for a release that this one..i felt ripped off.The Sound- The sound is very clear and crispy. No hiss sound or cracking sound.Extras- well another let down here.,3
"My star rating is for the BluRay, not the film itself.As much as I love this movie (and I do love this movie), I had to settle for the standard DVD version because of the sudden aspect ratio changes for the IMAX footage. I found this amazingly distracting and it constantly kept throwing me out of the movie. Hopefully someday they'll release another BluRay version that has the option to disable the IMAX ratio switch and I'll be able to upgrade, but until then I must make do with 480p when I watch this wonderful film. It's a shame, too, because other than the annoying ratio swapping the film looks amazing on BD.",3
that must have been the studios motto when they made the standard dvd. This has to be the worst transfer I have seen in modern film making. I am absolutely perplexed why this film was not made in DTS except as others have pointed out that perhaps they are trying to push Blu Ray.Its a great film ( I saw it three times in IMAX) but this dvd is a disappointment. We deserved better.,3
"Everyone knows about the movies that are very well written, casted, and directed. They are awarded and phrased films we've placed on our movie shelves for good looks and not show (There Will Be Blood, No Country For Old Men, Atonement, Titanic, Broke back Mountain, Batman Returns, may i continue...) . I have added The Dark Knight to the movie I must own, because it was great (and Heath Ledger died before it's release and has made it history), but i will never suffer through the three hours of talk talk talk and batman's boring humiliation AGAIN!!! EVER!",3
"Batman tries to destroy organized crime in Gotham. The Joker is the adversary here in this sequel to Batman Begins. It was one of the top two highest grossing films ever along with Spider Man 3. Comic fan or not, Batman has his origins in the 1930s with Detective Comics, hence the DC company. Nightwing was the original Robin. The secind Robin was killed by The Joker in A Death in the Family. In the Knightfall, Knightquest and Knightsend series in the 90s, Batman is crippled by a new villain named Bane. His latest protege Azrael dones an upgraded costume in his sit in as Batman. In Zero Hour Nightwing regrets Batman didn't take him as the fill in. They brought in Batgirl in like 1989.",3
"I really enjoyed Batman Begins and looked forward to this movie, but I was disappointed. The story line is great, the acting superb, but it is extremely dark and violent. I think it could all have been done as effectively without all the gratuitous ugliness. The depiction of the prosecutor after his burns was not believable and better suited to a horror movie. A very good concept taken too far.",3
"The acting was great!!! The movie, though, was very dark. I like a little more light!! Heath Ledger will be missed!!!!!!",3
"Apart from the mask, there isn't that much special about this limited edition. No audio commentary is my big complaint. However, the Batman Unmasked featurette is an unexpected pleasure, as it psychoanalyzes Batman in all his incarnations. I suspect there's another limited edition coming with more bells and whistles. Me, I bought this because I loved the movie and this set cost as much as the regular two-DVD edition.",3
"I wil not get into a review of the film itself, other than to say its an outstanding movie...far transending the genre into a truly imaginative frightening film. The DVD on the other hand is insultingly bad. Poor resolution...artifacts...edge enhancement....lots of compression...poor black levels...etc. Its dvds like this that make some believe that studios, especially Warrner Brothers are intentionaly degrading the potental quality on standard DVD to help push Blu Ray. Until this dvd I thought that was some paranoid delusion on the part of some film fans, but this DVD is so shoddy ...especially for such a film, that I can almost believe that they may be on to something. Shame on Warner Brothers for this truly sub standard DVD. I am a television producer, so I know what a DVD can and should look like...and this is NOT it!!!",3
"Yes, Christopher Nolan's ""The Dark Knight"" is an excellent film without question. BUT, shame on Warner Bros. for releasing such a not-so-special 2disk special edition for it's initial release onto DVD. NO INTERVIEWS WITH HEATH LEDGER? Or most of the cast and crew for that matter. Instead you get a scant pathetic 2 ""making off"" tiny featurettes, 6 lame episodes of ""Gotham Tonight"" the seperated IMAX scenes, and some yawn trailers and photo galleries. They're obviously saving the real good stuff for next year's release after Ledger's won the Best Supporting Actor Oscar for his amazing portrayal of the Joker.So yes, the film rocks, this release sucks though, so Please...be Patient.",3
"Normally I'm pretty satisfied with my OtterBox purchases, but this one was a bit disappointing. Because the glitter case is clear, it's not made of a hard plastic like the others. For some reason I thought it would be a little harder but it's a flexible plastic. Also, as a side note, don't be dumb like me and use acetone or nail polish remover around this. I melted the side of it within the first couple of days of having it.",4
Love this kit as it is cheap but feels solid. It is easy to use and is nice and sharp out the box.,4
"So far so good. Very easy to install, easy cleaning, super smooth operation and great water flow.",4
"This is a pretty sturdy, safe alternative to the traditional mandolin (though still use caution). Has several functions that all work decently for the cost. Good for a college student like I was - just starting out and wanting food simply chopped (not pretty). Bought it a while ago and kept it for about two years.It can have trouble cutting through tough veggies like potatoes and onions, so I needed to cut them in halves or quarters to cut them. Food gets very easily stuck, and is very difficult to clean out in the sink. Not sure if it’s dishwasher friendly, as I don’t have one.",4
"I love the nesting feature, but I am constantly worried about using a very high temperature while cooking. According to the instructions it strongly suggests to use a medium flame. Also, there is a weird grayish residue between washes on the bottom exterior of the pans. I think other than scratching each other that’s the reason for the felt dividers that came with the set. I feel like it should have one more large pot lid added so you can use multiple pots simultaneously. The cold storage lids don’t snap on, so they don’t feel secure when storing food in the fridge. Easy to clean both by hand and in a dishwasher.",4
"These have heavy enough bottom to not warp when cooking at medium-high heat. Come out clean from the dishwasher. As long as you don't dunk them in cold water when they are hot, these will stay good for a while.They are good for making omelets and sunny side up eggs; or even fried potatoes for a small family. Big enough well for deglazing and reduction of sauces, but obviously you don't want to make a bechamel sauce in these pans.",4
"I have a go-to set of mixing bowls that I love. But sometimes, especially during holidays and large cooking get togethers, I want to use a different set so I am not forced to wash and dry my set of 4 so often. So, in preparation for a large gathering weekend, I bought this set. I used many of the bowls and lids for the mass cooking adventure. I was pleased with the sizes and appearance of the bowls. I was able to use them for serving some dishes too. The lids worked well. I did not use the shredding feature so I cannot comment on that.I will note that the bowls are not thick or very sturdy. I hand washed all pieces so that they would not be warped. I saw in other comments that the kids warped over time. By hand washing, I suspect that won’t happen to mine. They are not thick, I emphasize. I do not plan to use these as my sturdy, everyday pieces but they will serve well as my secondary set. The metal is shiny but I suspect it will dull and scratch over time but that is just aesthetics. I love the bottoms as they do not move when mixing. For the money, this is a great set of bowls. I would not use them daily but I recommend them for back up prep and storing.",4
Nice sharp sturdy knife! Damascus pattern is not as visible in person,4
"Talk about being duped, read everything about this knife and was convinced it was made in Japan & sold in America, but alas, yes, sold in America but ""MADE IN CHINA"". I'm really getting sick & tired of this crap, AMAZON you need to lift your game & demand that these sellers display where the item is made!!!!!!! When I find an item that I'm tempted to buy it is the first thing I look for ""where it's made"" & if it's made in China then that's a NO GO for me because I've had to much CRAP from them & the quality is disgraceful, so if an item cannot display where it's made then I'll just move along or go without.",4
